{
  "$schema": "https://json-schema.org/draft/2020-12/schema",
  "title": "TrainingFeedback external plan response",
  "type": "object",
  "required": [
    "schema",
    "schema_version",
    "rationale",
    "plan"
  ],
  "properties": {
    "schema": {
      "const": "training_feedback.plan"
    },
    "schema_version": {
      "const": 1
    },
    "rationale": {
      "type": "string"
    },
    "source": {
      "type": "object",
      "properties": {
        "session_id": {
          "type": [
            "integer",
            "null"
          ],
          "minimum": 1
        },
        "export_id": {
          "type": [
            "integer",
            "null"
          ],
          "minimum": 1
        }
      }
    },
    "plan": {
      "type": "object",
      "required": [
        "name",
        "purpose",
        "days"
      ],
      "properties": {
        "name": {
          "type": "string",
          "minLength": 1
        },
        "target_plan_name": {
          "type": [
            "string",
            "null"
          ]
        },
        "purpose": {
          "type": "string"
        },
        "days": {
          "type": "array",
          "minItems": 1,
          "items": {
            "type": "object",
            "required": [
              "order",
              "name",
              "actions"
            ],
            "properties": {
              "order": {
                "type": "integer",
                "minimum": 1
              },
              "name": {
                "type": "string",
                "minLength": 1
              },
              "actions": {
                "type": "array",
                "minItems": 1,
                "items": {
                  "type": "object",
                  "required": [
                    "order",
                    "exercise_name",
                    "phase",
                    "sets"
                  ],
                  "properties": {
                    "order": {
                      "type": "integer",
                      "minimum": 1
                    },
                    "exercise_name": {
                      "type": "string"
                    },
                    "phase": {
                      "enum": [
                        "preparation",
                        "main",
                        "cooldown"
                      ]
                    },
                    "rest_seconds": {
                      "type": "number",
                      "minimum": 0
                    },
                    "note": {
                      "type": "string"
                    },
                    "sets": {
                      "type": "array",
                      "minItems": 1,
                      "items": {
                        "type": "object",
                        "required": [
                          "order",
                          "unit"
                        ],
                        "properties": {
                          "order": {
                            "type": "integer",
                            "minimum": 1
                          },
                          "value": {
                            "type": [
                              "number",
                              "null"
                            ],
                            "minimum": 0
                          },
                          "unit": {
                            "enum": [
                              "reps",
                              "seconds",
                              "minutes",
                              "breaths",
                              "free"
                            ]
                          },
                          "per_side": {
                            "type": "boolean"
                          },
                          "note": {
                            "type": "string"
                          }
                        }
                      }
                    }
                  }
                }
              }
            }
          }
        }
      }
    }
  }
}
