{
  "schema": "training_feedback.plan",
  "schema_version": 1,
  "rationale": "【合成验收数据】外部专家建议：臀桥剂量提升到每侧 14 次。",
  "plan": {
    "name": "【合成验收数据】验收演示计划",
    "target_plan_name": "【合成验收数据】验收演示计划",
    "purpose": "【合成验收数据】导入草稿，等待人工核对，不应已激活。",
    "days": [
      {
        "order": 1,
        "name": "【合成验收数据】训练日",
        "actions": [
          {
            "order": 1,
            "exercise_name": "臀桥",
            "phase": "main",
            "rest_seconds": 45,
            "note": "【合成验收数据】导入备注原文",
            "sets": [
              {
                "order": 1,
                "value": 14,
                "unit": "reps",
                "per_side": true,
                "note": "【合成验收数据】逐字保留"
              },
              {
                "order": 2,
                "value": 14,
                "unit": "reps",
                "per_side": true,
                "note": ""
              }
            ]
          }
        ]
      }
    ]
  }
}